task_id,task_name,trigger,recommended_context_route,recommended_agent,reasoning_effort,risk_level,validation_command,measurement_task_id,notes
small-edit,Small deterministic edit,One or two file edit typo docs small CLI wiring,codex-routing,main,medium,low,git diff --check,route-small-edit,Keep in main flow and avoid subagent overhead.
unfamiliar-discovery,Unfamiliar repo discovery,Need to locate docs source files tests or generated reports,codex-routing,kb_explorer,medium,low,PYTHONPATH=src python3 -m draft_room_intelligence.cli report-codex-context-routes data/reference/codex_context_routes.csv outputs/codex_context_routes,route-context-discovery,Use read-only explorer only when the matching route is not enough.
demo-update,Demo readiness or UX update,Demo export site readiness presenter report or player detail issue,demo-readiness,main,medium,medium,PYTHONPATH=src python3 -m draft_room_intelligence.cli report-demo-acceptance outputs/demo_2025_openstats_russian_nordic_cleanup_ep_pdf outputs/demo_2025_openstats_russian_nordic_cleanup_ep_pdf/reports/demo_acceptance,route-demo-readiness,Start from generated readiness reports before raw JSON.
ingestion-change,Ingestion or evidence change,Parser source coverage merge duplicate goalie stat or evidence problem,ingestion-debug,reviewer,high,high,PYTHONPATH=src python3 -m draft_room_intelligence.cli report-ingestion-plan data/reference/ingestion_source_families.csv outputs/ingestion_plan,route-ingestion-debug,Use reviewer after implementation because source contracts and evidence can regress silently.
ranking-calibration,Ranking or model calibration,Model score board score role bias consensus or EP evidence weighting,modeling-calibration,reviewer,high,high,PYTHONPATH=src python3 -m draft_room_intelligence.cli report-demo-sanity outputs/demo_2025_openstats_russian_nordic_cleanup_ep_pdf outputs/demo_2025_openstats_russian_nordic_cleanup_ep_pdf/reports/demo_sanity,route-modeling-calibration,Reviewer should check business credibility and unintended ranking shifts.
team-fit-change,Team fit and roster analytics,NHL AHL depth U23 pipeline team adjusted score or what-if franchise question,team-fit,reviewer,high,high,make team-depth-sample,route-team-fit,Separate NHL-ready roster from AHL and prospect pipeline before changing fit logic.
usage-measurement,Codex usage measurement,Token consumption dashboard benchmark route measurement or audit question,codex-routing,main,medium,medium,PYTHONPATH=src python3 -m draft_room_intelligence.cli report-codex-usage outputs/codex_usage/run_log.csv outputs/codex_usage_report,route-usage-measurement,Keep this lightweight and compare baseline vs routed runs.
